{
  "record": "judgment/1",
  "id": "JDG-0003",
  "kind": "sign-off",
  "date": "2026-07-19",
  "by": "AdarGit008",
  "subject": "TEST-04",
  "reason": "Re-minted from the V1 signoff.json ledger at the M7b transition (original sign-off: AdarGit008, 2026-07-05). add() acceptance — numbers in -> sum; non-number -> TypeError — matches the test exactly; still true today.",
  "review_by": "2027-01-19"
}
